<?xml version="1.0" encoding="UTF-8"?>
<!DOCTYPE machines SYSTEM "Machine.dtd">
<machines>
  <machine name="M1">
<state name="q1">
<labels>
<labelPair name="1">
<instance>b</instance>
</labelPair>
<labelPair name="2">
<instance>c</instance>
</labelPair>
</labels>
<decisionTree> <branch>
<predicate>
<atom machineName="M2">
<labelPair name="1">
<instance>d</instance>
</labelPair>
</atom>
</predicate>
<consequent>
<decisionTree>
<branch>
<predicate>
<or>
<predicate>
<atom machineName="M2">
<labelPair name="2">
<instance>d</instance>
</labelPair>
</atom>
</predicate>
<predicate>
<atom machineName="M2">
<labelPair name="3">
<instance>d</instance>
</labelPair>
</atom>
</predicate>
</or>
</predicate>
<consequent>
<decisionTree>
<probability>
<stateName>1</stateName>
<pValue>1,3</pValue>
<stateName>2</stateName>
<pValue>2,3</pValue>
</probability>
</decisionTree>
</consequent>
<alternative>
<decisionTree>
<probability>
<stateName>2</stateName>
<pValue>1,1</pValue>
</probability>
</decisionTree>
</alternative>
</branch>
</decisionTree>
</consequent>
<alternative>
<decisionTree>
<branch>
<predicate>
<and>
<predicate>
<neg>
<predicate>
<atom machineName="M2">
<labelPair name="1">
<instance>e</instance>
</labelPair>
</atom>
</predicate>
</neg>
</predicate>
<predicate>
<implies>
<predicate>
<atom machineName="M2">
<labelPair name="1">
<instance>a</instance>
</labelPair>
</atom>
</predicate>
<predicate>
<atom machineName="M2">
<labelPair name="1">
<instance>b</instance>
</labelPair>
</atom>
</predicate>
</implies>
</predicate>
</and>
</predicate>
<consequent>
<decisionTree>
<probability>
<stateName>1</stateName>
<pValue>1,2</pValue>
<stateName>2</stateName>
<pValue>1,2</pValue>
</probability>
</decisionTree>
</consequent>
<alternative>
<decisionTree>
<probability>
<stateName>1</stateName>
<pValue>1,4</pValue>
<stateName>2</stateName>
<pValue>3,4</pValue>
</probability>
</decisionTree>
</alternative>
</branch>
</decisionTree>
</alternative>
</branch>
</decisionTree>
</state>
<state name="q2">
<labels>
<labelPair name="1">
<instance>d</instance>
</labelPair>
<labelPair name="2">
<instance>e</instance>
</labelPair>
</labels>
<decisionTree> <branch>
<predicate>
<atom machineName="M2">
<labelPair name="1">
<instance>d</instance>
</labelPair>
</atom>
</predicate>
<consequent>
<decisionTree>
<branch>
<predicate>
<or>
<predicate>
<atom machineName="M2">
<labelPair name="2">
<instance>d</instance>
</labelPair>
</atom>
</predicate>
<predicate>
<atom machineName="M2">
<labelPair name="3">
<instance>d</instance>
</labelPair>
</atom>
</predicate>
</or>
</predicate>
<consequent>
<decisionTree>
<probability>
<stateName>1</stateName>
<pValue>1,3</pValue>
<stateName>2</stateName>
<pValue>2,3</pValue>
</probability>
</decisionTree>
</consequent>
<alternative>
<decisionTree>
<probability>
<stateName>2</stateName>
<pValue>1,1</pValue>
</probability>
</decisionTree>
</alternative>
</branch>
</decisionTree>
</consequent>
<alternative>
<decisionTree>
<branch>
<predicate>
<and>
<predicate>
<atom machineName="M2">
<labelPair name="1">
<instance>e</instance>
</labelPair>
</atom>
</predicate>
<predicate>
<atom machineName="M2">
<labelPair name="1">
<instance>a</instance>
</labelPair>
</atom>
</predicate>
<predicate>
<or>
<predicate>
<atom machineName="M2">
<labelPair name="1">
<instance>b</instance>
</labelPair>
</atom>
</predicate>
<predicate>
<atom machineName="M2">
<labelPair name="1">
<instance>c</instance>
</labelPair>
</atom>
</predicate>
<predicate>
<atom machineName="M2">
<labelPair name="2">
<instance>c</instance>
</labelPair>
</atom>
</predicate>
</or>
</predicate>
</and>
</predicate>
<consequent>
<decisionTree>
<probability>
<stateName>1</stateName>
<pValue>1,2</pValue>
<stateName>2</stateName>
<pValue>1,2</pValue>
</probability>
</decisionTree>
</consequent>
<alternative>
<decisionTree>
<probability>
<stateName>1</stateName>
<pValue>1,4</pValue>
<stateName>2</stateName>
<pValue>3,4</pValue>
</probability>
</decisionTree>
</alternative>
</branch>
</decisionTree>
</alternative>
</branch>
</decisionTree>
</state>
</machine>
  <machine name="M2">
<state name="q1">
<labels>
<labelPair name="1">
<instance>c</instance>
</labelPair>
<labelPair name="2">
<instance>b</instance>
</labelPair>
<labelPair name="3">
<instance>e</instance>
</labelPair>
</labels>
<decisionTree> <branch>
<predicate>
<atom machineName="M1">
<labelPair name="1">
<instance>d</instance>
</labelPair>
</atom>
</predicate>
<consequent>
<decisionTree>
<branch>
<predicate>
<or>
<predicate>
<atom machineName="M1">
<labelPair name="2">
<instance>d</instance>
</labelPair>
</atom>
</predicate>
<predicate>
<atom machineName="M1">
<labelPair name="2">
<instance>d</instance>
</labelPair>
</atom>
</predicate>
</or>
</predicate>
<consequent>
<decisionTree>
<probability>
<stateName>1</stateName>
<pValue>1,3</pValue>
<stateName>2</stateName>
<pValue>2,3</pValue>
</probability>
</decisionTree>
</consequent>
<alternative>
<decisionTree>
<probability>
<stateName>2</stateName>
<pValue>1,1</pValue>
</probability>
</decisionTree>
</alternative>
</branch>
</decisionTree>
</consequent>
<alternative>
<decisionTree>
<branch>
<predicate>
<atom machineName="M1">
<labelPair name="1">
<instance>e</instance>
</labelPair>
</atom>
</predicate>
<consequent>
<decisionTree>
<probability>
<stateName>1</stateName>
<pValue>1,2</pValue>
<stateName>2</stateName>
<pValue>1,2</pValue>
</probability>
</decisionTree>
</consequent>
<alternative>
<decisionTree>
<probability>
<stateName>1</stateName>
<pValue>1,4</pValue>
<stateName>2</stateName>
<pValue>3,4</pValue>
</probability>
</decisionTree>
</alternative>
</branch>
</decisionTree>
</alternative>
</branch>
</decisionTree>
</state>
<state name="q2">
<labels>
<labelPair name="1">
<instance>a</instance>
</labelPair>
<labelPair name="2">
<instance>c</instance>
</labelPair>
<labelPair name="3">
<instance>d</instance>
</labelPair>
</labels>
<decisionTree> <branch>
<predicate>
<atom machineName="M1">
<labelPair name="1">
<instance>e</instance>
</labelPair>
</atom>
</predicate>
<consequent>
<decisionTree>
<branch>
<predicate>
<or>
<predicate>
<atom machineName="M1">
<labelPair name="2">
<instance>f</instance>
</labelPair>
</atom>
</predicate>
<predicate>
<atom machineName="M1">
<labelPair name="2">
<instance>e</instance>
</labelPair>
</atom>
</predicate>
</or>
</predicate>
<consequent>
<decisionTree>
<probability>
<stateName>1</stateName>
<pValue>1,3</pValue>
<stateName>2</stateName>
<pValue>2,3</pValue>
</probability>
</decisionTree>
</consequent>
<alternative>
<decisionTree>
<probability>
<stateName>2</stateName>
<pValue>1,1</pValue>
</probability>
</decisionTree>
</alternative>
</branch>
</decisionTree>
</consequent>
<alternative>
<decisionTree>
<branch>
<predicate>
<atom machineName="M1">
<labelPair name="1">
<instance>a</instance>
</labelPair>
</atom>
</predicate>
<consequent>
<decisionTree>
<probability>
<stateName>1</stateName>
<pValue>1,2</pValue>
<stateName>3</stateName>
<pValue>1,2</pValue>
</probability>
</decisionTree>
</consequent>
<alternative>
<decisionTree>
<probability>
<stateName>3</stateName>
<pValue>1,4</pValue>
<stateName>2</stateName>
<pValue>3,4</pValue>
</probability>
</decisionTree>
</alternative>
</branch>
</decisionTree>
</alternative>
</branch>
</decisionTree>
</state>
<state name="q3">
<labels>
<labelPair name="1">
<instance>b</instance>
</labelPair>
<labelPair name="2">
<instance>c</instance>
</labelPair>
<labelPair name="3">
<instance>a</instance>
</labelPair>
</labels>
<decisionTree> <branch>
<predicate>
<atom machineName="M1">
<labelPair name="1">
<instance>d</instance>
</labelPair>
</atom>
</predicate>
<consequent>
<decisionTree>
<branch>
<predicate>
<or>
<predicate>
<atom machineName="M1">
<labelPair name="2">
<instance>d</instance>
</labelPair>
</atom>
</predicate>
<predicate>
<atom machineName="M1">
<labelPair name="2">
<instance>e</instance>
</labelPair>
</atom>
</predicate>
</or>
</predicate>
<consequent>
<decisionTree>
<probability>
<stateName>1</stateName>
<pValue>1,3</pValue>
<stateName>3</stateName>
<pValue>2,3</pValue>
</probability>
</decisionTree>
</consequent>
<alternative>
<decisionTree>
<probability>
<stateName>1</stateName>
<pValue>1,1</pValue>
</probability>
</decisionTree>
</alternative>
</branch>
</decisionTree>
</consequent>
<alternative>
<decisionTree>
<branch>
<predicate>
<atom machineName="M1">
<labelPair name="1">
<instance>e</instance>
</labelPair>
</atom>
</predicate>
<consequent>
<decisionTree>
<probability>
<stateName>3</stateName>
<pValue>1,2</pValue>
<stateName>1</stateName>
<pValue>1,2</pValue>
</probability>
</decisionTree>
</consequent>
<alternative>
<decisionTree>
<probability>
<stateName>1</stateName>
<pValue>1,4</pValue>
<stateName>3</stateName>
<pValue>3,4</pValue>
</probability>
</decisionTree>
</alternative>
</branch>
</decisionTree>
</alternative>
</branch>
</decisionTree>
</state>
</machine>
</machines>
