<?xml version="1.0" encoding="UTF-8"?><!DOCTYPE machines SYSTEM "Machine.dtd">
<machines>
  <machine name="MPatient:ICP"><state name="InitLow"><labels><labelPair name="Cost"><instance>10000</instance></labelPair><labelPair name="Patient"><instance>G</instance></labelPair><labelPair name="ICP"><instance>A</instance></labelPair></labels><decisionTree><probability><stateName>InitLow</stateName><pValue>65,100</pValue><stateName>High</stateName><pValue>1,10</pValue><stateName>Dead</stateName><pValue>5,100</pValue><stateName>Exit</stateName><pValue>2,10</pValue></probability></decisionTree></state><state name="High"><labels><labelPair name="Cost"><instance>20000</instance></labelPair><labelPair name="Patient"><instance>B</instance></labelPair><labelPair name="ICP"><instance>B</instance></labelPair></labels><decisionTree><probability><stateName>High</stateName><pValue>5,10</pValue><stateName>Low</stateName><pValue>35,100</pValue><stateName>Dead</stateName><pValue>15,100</pValue></probability></decisionTree></state><state name="Exit"><labels><labelPair name="Cost"><instance>3000</instance></labelPair><labelPair name="Patient"><instance>G</instance></labelPair><labelPair name="ICP"><instance>E</instance></labelPair></labels><decisionTree><probability><stateName>Exit</stateName><pValue>1,1</pValue></probability></decisionTree></state><state name="Dead"><labels><labelPair name="Cost"><instance>25000</instance></labelPair><labelPair name="Patient"><instance>NA</instance></labelPair><labelPair name="ICP"><instance>D</instance></labelPair></labels><decisionTree><probability><stateName>Dead</stateName><pValue>1,1</pValue></probability></decisionTree></state><state name="Low"><labels><labelPair name="Cost"><instance>6000</instance></labelPair><labelPair name="Patient"><instance>G</instance></labelPair><labelPair name="ICP"><instance>C</instance></labelPair></labels><decisionTree><probability><stateName>High</stateName><pValue>5,100</pValue><stateName>Low</stateName><pValue>5,10</pValue><stateName>Dead</stateName><pValue>5,100</pValue><stateName>Exit</stateName><pValue>4,10</pValue></probability></decisionTree></state></machine>
</machines>